{"schema_version":"1.0.0","baseline":{"label":"Initial indexed combat release","dataset_schema_version":"1.2.0","client_versions":{"dragon_and_ability":"1787687230","progression":"1787687231"},"inventory":{"dragons":37,"abilities":259,"statuses":23,"map_nodes":7912,"schedules":192,"conditions":96,"targeters":342,"prioritizers":50,"status_operations":190}},"current":{"label":"Current generated release","dataset_schema_version":"1.3.0","client_versions":{"dragon_and_ability":"1787687230","progression":"1787687231"},"inventory":{"dragons":37,"abilities":259,"statuses":23,"map_nodes":7912,"schedules":274,"conditions":88,"targeters":342,"prioritizers":50,"status_operations":190}},"comparison_state":"changes_detected","summary":{"added":0,"changed":259,"removed":0,"source_files_changed":0},"changes":[{"entity_id":"ability:dragon_generic_antares:command_unique_antares_01","entity_type":"ability","name":"Relentless Pursuit","parent_id":"dragon:dragon_generic_antares","change_type":"changed","changed_fields":["graph","normalized"]},{"entity_id":"ability:dragon_generic_antares:habit_dragon_antares_slot1_01","entity_type":"ability","name":"Hunter's Wrath","parent_id":"dragon:dragon_generic_antares","change_type":"changed","changed_fields":["normalized"]},{"entity_id":"ability:dragon_generic_antares:habit_dragon_antares_slot2_01","entity_type":"ability","name":"Blazing Onslaught","parent_id":"dragon:dragon_generic_antares","change_type":"changed","changed_fields":["normalized"]},{"entity_id":"ability:dragon_generic_antares:habit_dragon_antares_slot3_01","entity_type":"ability","name":"Dragon's Flair","parent_id":"dragon:dragon_generic_antares","change_type":"changed","changed_fields":["graph","normalized"]},{"entity_id":"ability:dragon_generic_antares:habit_dragon_antares_slot4_01","entity_type":"ability","name":"Fiery Precision","parent_id":"dragon:dragon_generic_antares","change_type":"changed","changed_fields":["graph","normalized"]},{"entity_id":"ability:dragon_generic_antares:habit_dragon_antares_slot5_01","entity_type":"ability","name":"Dragon's Intellect","parent_id":"dragon:dragon_generic_antares","change_type":"changed","changed_fields":["graph","normalized"]},{"entity_id":"ability:dragon_generic_antares:habit_dragon_antares_slot6_01","entity_type":"ability","name":"Redemption","parent_id":"dragon:dragon_generic_antares","change_type":"changed","changed_fields":["graph","normalized"]},{"entity_id":"ability:dragon_generic_arulix:command_unique_arulix_01","entity_type":"ability","name":"Gleaming Spiral","parent_id":"dragon:dragon_generic_arulix","change_type":"changed","changed_fields":["normalized"]},{"entity_id":"ability:dragon_generic_arulix:habit_dragon_arulix_slot1_01","entity_type":"ability","name":"Champion's Brilliance","parent_id":"dragon:dragon_generic_arulix","change_type":"changed","changed_fields":["normalized"]},{"entity_id":"ability:dragon_generic_arulix:habit_dragon_arulix_slot2_01","entity_type":"ability","name":"Hypnotic Helix","parent_id":"dragon:dragon_generic_arulix","change_type":"changed","changed_fields":["graph","normalized"]},{"entity_id":"ability:dragon_generic_arulix:habit_dragon_arulix_slot3_01","entity_type":"ability","name":"Battle Cunning","parent_id":"dragon:dragon_generic_arulix","change_type":"changed","changed_fields":["graph","normalized"]},{"entity_id":"ability:dragon_generic_arulix:habit_dragon_arulix_slot4_01","entity_type":"ability","name":"Spiral Surge","parent_id":"dragon:dragon_generic_arulix","change_type":"changed","changed_fields":["normalized"]},{"entity_id":"ability:dragon_generic_arulix:habit_dragon_arulix_slot5_01","entity_type":"ability","name":"Iron Shell","parent_id":"dragon:dragon_generic_arulix","change_type":"changed","changed_fields":["graph","normalized"]},{"entity_id":"ability:dragon_generic_arulix:habit_dragon_arulix_slot6_01","entity_type":"ability","name":"Mimicry","parent_id":"dragon:dragon_generic_arulix","change_type":"changed","changed_fields":["graph","normalized"]},{"entity_id":"ability:dragon_generic_bevlorin:command_unique_bevlorin_01","entity_type":"ability","name":"Nature's Reckoning","parent_id":"dragon:dragon_generic_bevlorin","change_type":"changed","changed_fields":["graph","normalized"]},{"entity_id":"ability:dragon_generic_bevlorin:habit_dragon_bevlorin_slot1_01","entity_type":"ability","name":"Champion's Vigor","parent_id":"dragon:dragon_generic_bevlorin","change_type":"changed","changed_fields":["graph","normalized"]},{"entity_id":"ability:dragon_generic_bevlorin:habit_dragon_bevlorin_slot2_01","entity_type":"ability","name":"Fire Ward","parent_id":"dragon:dragon_generic_bevlorin","change_type":"changed","changed_fields":["graph","normalized"]},{"entity_id":"ability:dragon_generic_bevlorin:habit_dragon_bevlorin_slot3_01","entity_type":"ability","name":"Dragon's Fury","parent_id":"dragon:dragon_generic_bevlorin","change_type":"changed","changed_fields":["graph","normalized"]},{"entity_id":"ability:dragon_generic_bevlorin:habit_dragon_bevlorin_slot4_01","entity_type":"ability","name":"Renewal","parent_id":"dragon:dragon_generic_bevlorin","change_type":"changed","changed_fields":["graph","normalized"]},{"entity_id":"ability:dragon_generic_bevlorin:habit_dragon_bevlorin_slot5_01","entity_type":"ability","name":"Vital Essence","parent_id":"dragon:dragon_generic_bevlorin","change_type":"changed","changed_fields":["graph","normalized"]},{"entity_id":"ability:dragon_generic_bevlorin:habit_dragon_bevlorin_slot6_01","entity_type":"ability","name":"Bountiful Gifts","parent_id":"dragon:dragon_generic_bevlorin","change_type":"changed","changed_fields":["normalized"]},{"entity_id":"ability:dragon_generic_crimson:command_unique_crimson_01","entity_type":"ability","name":"Bloodscale Terror","parent_id":"dragon:dragon_generic_crimson","change_type":"changed","changed_fields":["graph","normalized"]},{"entity_id":"ability:dragon_generic_crimson:habit_dragon_crimson_slot1_01","entity_type":"ability","name":"Hunter's Cunning","parent_id":"dragon:dragon_generic_crimson","change_type":"changed","changed_fields":["graph","normalized"]},{"entity_id":"ability:dragon_generic_crimson:habit_dragon_crimson_slot2_01","entity_type":"ability","name":"Enervate","parent_id":"dragon:dragon_generic_crimson","change_type":"changed","changed_fields":["graph","normalized"]},{"entity_id":"ability:dragon_generic_crimson:habit_dragon_crimson_slot3_01","entity_type":"ability","name":"Dragon's Intellect","parent_id":"dragon:dragon_generic_crimson","change_type":"changed","changed_fields":["graph","normalized"]},{"entity_id":"ability:dragon_generic_crimson:habit_dragon_crimson_slot4_01","entity_type":"ability","name":"Bloodscale Fury","parent_id":"dragon:dragon_generic_crimson","change_type":"changed","changed_fields":["graph","normalized"]},{"entity_id":"ability:dragon_generic_crimson:habit_dragon_crimson_slot5_01","entity_type":"ability","name":"Unlikely Hero","parent_id":"dragon:dragon_generic_crimson","change_type":"changed","changed_fields":["graph","normalized"]},{"entity_id":"ability:dragon_generic_crimson:habit_dragon_crimson_slot6_01","entity_type":"ability","name":"Vermin's Bane","parent_id":"dragon:dragon_generic_crimson","change_type":"changed","changed_fields":["graph","normalized"]},{"entity_id":"ability:dragon_generic_daemoros:command_unique_daemoros_01","entity_type":"ability","name":"Shadowflame","parent_id":"dragon:dragon_generic_daemoros","change_type":"changed","changed_fields":["graph","normalized"]},{"entity_id":"ability:dragon_generic_daemoros:habit_dragon_daemoros_slot1_01","entity_type":"ability","name":"Warrior's Zeal","parent_id":"dragon:dragon_generic_daemoros","change_type":"changed","changed_fields":["normalized"]},{"entity_id":"ability:dragon_generic_daemoros:habit_dragon_daemoros_slot2_01","entity_type":"ability","name":"Instill Fear","parent_id":"dragon:dragon_generic_daemoros","change_type":"changed","changed_fields":["graph","normalized"]},{"entity_id":"ability:dragon_generic_daemoros:habit_dragon_daemoros_slot3_01","entity_type":"ability","name":"Powerful Reflexes","parent_id":"dragon:dragon_generic_daemoros","change_type":"changed","changed_fields":["graph","normalized"]},{"entity_id":"ability:dragon_generic_daemoros:habit_dragon_daemoros_slot4_01","entity_type":"ability","name":"Shroud of Shadows","parent_id":"dragon:dragon_generic_daemoros","change_type":"changed","changed_fields":["graph","normalized"]},{"entity_id":"ability:dragon_generic_daemoros:habit_dragon_daemoros_slot5_01","entity_type":"ability","name":"Darkening Fear","parent_id":"dragon:dragon_generic_daemoros","change_type":"changed","changed_fields":["graph","normalized"]},{"entity_id":"ability:dragon_generic_daemoros:habit_dragon_daemoros_slot6_01","entity_type":"ability","name":"Phantom's Veil","parent_id":"dragon:dragon_generic_daemoros","change_type":"changed","changed_fields":["normalized"]},{"entity_id":"ability:dragon_generic_dawnseeker:command_unique_dawnseeker_01","entity_type":"ability","name":"Radiant Wings","parent_id":"dragon:dragon_generic_dawnseeker","change_type":"changed","changed_fields":["graph","normalized"]},{"entity_id":"ability:dragon_generic_dawnseeker:habit_dragon_dawnseeker_slot1_01","entity_type":"ability","name":"Sentinel's Presence","parent_id":"dragon:dragon_generic_dawnseeker","change_type":"changed","changed_fields":["graph","normalized"]},{"entity_id":"ability:dragon_generic_dawnseeker:habit_dragon_dawnseeker_slot2_01","entity_type":"ability","name":"Tactical Inferno","parent_id":"dragon:dragon_generic_dawnseeker","change_type":"changed","changed_fields":["normalized"]},{"entity_id":"ability:dragon_generic_dawnseeker:habit_dragon_dawnseeker_slot3_01","entity_type":"ability","name":"Unbroken Devotion","parent_id":"dragon:dragon_generic_dawnseeker","change_type":"changed","changed_fields":["graph","normalized"]},{"entity_id":"ability:dragon_generic_dawnseeker:habit_dragon_dawnseeker_slot4_01","entity_type":"ability","name":"Sunbreak","parent_id":"d